{
  "$schema": "./tokens.schema.json",
  "$version": "2.0.0",
  "$description": "CMU MSA Design Tokens — the canonical, machine-readable source of truth. If this file and the brand guide prose disagree on a value, this file governs. The brand guide governs usage rules.",
  "color": {
    "$description": "Light-mode palette. All values are sRGB hex.",
    "midnight-teal": "#0D2828",
    "warm-cream": "#FAF7F2",
    "cmu-red": "#C41230",
    "msa-teal": "#1F4C4C",
    "gold-thread": "#FDB515",
    "iron-gray": "#6D6E71",
    "steel-gray": "#E0E0E0",
    "pure-white": "#FFFFFF",
    "ink": "#1A1A1A",
    "cmu-red-50": "#FBE9EC",
    "cmu-red-700": "#9E0F26",
    "msa-teal-50": "#E7F0F0",
    "msa-teal-700": "#163838",
    "msa-gold-700": "#D9970A",
    "midnight-800": "#1A3F3F",
    "cream-50": "#F3EFE8"
  },
  "color-dark": {
    "$description": "Dark-mode overrides. Surface is neutral charcoal, accents are lightened to pass WCAG AA on dark backgrounds.",
    "surface": "#1A1A1A",
    "surface-raised": "#2A2A2A",
    "text-primary": "#FAF7F2",
    "text-secondary": "#A0A0A0",
    "accent-red": "#E8485E",
    "accent-teal": "#3D9E9E",
    "accent-gold": "#FDB515",
    "border": "#3A3A3A",
    "muted": "#6D6E71"
  },
  "typography": {
    "$description": "Font families, weights, scale, and tracking. Sizes in rem (base 16px). Tracking values produce the editorial polish seen in premium design systems.",
    "family-display": "Spectral",
    "family-heading": "Plus Jakarta Sans",
    "family-body": "Lora",
    "family-arabic": "Amiri",
    "family-arabic-quran": "Amiri Quran",
    "family-arabic-heading": "Cairo",
    "fallback-display": "Georgia, 'Times New Roman', serif",
    "fallback-heading": "system-ui, -apple-system, 'Segoe UI', sans-serif",
    "fallback-body": "Georgia, 'Times New Roman', serif",
    "fallback-arabic": "'Noto Naskh Arabic', serif",
    "fallback-arabic-heading": "'Noto Sans Arabic', sans-serif",
    "scale-display": "3rem",
    "scale-h1": "2.25rem",
    "scale-h2": "1.75rem",
    "scale-h3": "1.375rem",
    "scale-body": "1.0625rem",
    "scale-lead": "1.25rem",
    "scale-small": "0.875rem",
    "weight-display": 400,
    "weight-heading-bold": 700,
    "weight-heading-semi": 600,
    "weight-heading-medium": 500,
    "weight-body": 400,
    "weight-body-medium": 500,
    "line-height-display": 1.1,
    "line-height-heading": 1.2,
    "line-height-body": 1.65,
    "tracking-display": "-0.02em",
    "tracking-heading": "-0.01em",
    "tracking-body": "0",
    "measure-max": "75ch"
  },
  "spacing": {
    "$description": "4pt base grid. Named steps from 2px to 96px. Use these for all padding, margin, and gap values.",
    "unit": "4px",
    "scale": {
      "4xs": "2px",
      "3xs": "4px",
      "2xs": "6px",
      "xs": "8px",
      "sm": "12px",
      "md": "16px",
      "lg": "24px",
      "xl": "32px",
      "2xl": "48px",
      "3xl": "64px",
      "4xl": "96px"
    },
    "section-padding-y": "64px",
    "section-padding-y-mobile": "48px",
    "card-padding": "24px",
    "page-gutter": "16px",
    "page-gutter-desktop": "24px"
  },
  "radius": {
    "standard": "12px",
    "small": "6px",
    "pill": "9999px",
    "none": "0px"
  },
  "motion": {
    "duration-fast": "100ms",
    "duration-default": "200ms",
    "duration-slow": "400ms",
    "easing-default": "cubic-bezier(0.4, 0, 0.2, 1)",
    "easing-enter": "cubic-bezier(0, 0, 0.2, 1)",
    "easing-exit": "cubic-bezier(0.4, 0, 1, 1)"
  },
  "elevation": {
    "sm": "0 1px 2px rgba(0,0,0,0.06), 0 1px 3px rgba(0,0,0,0.1)",
    "md": "0 4px 6px rgba(0,0,0,0.07), 0 2px 4px rgba(0,0,0,0.06)",
    "none": "none"
  },
  "focus": {
    "ring-width": "3px",
    "ring-color": "#1F4C4C",
    "ring-offset": "2px"
  },
  "border": {
    "width-default": "1px",
    "width-accent": "4px",
    "color-default": "#E0E0E0"
  }
}